{
  "$schema": "ai-project-report.schema.json",
  "modelId": "ai-project-engineering-report",
  "version": "0.1",
  "status": "active",
  "description": "Defines the report modules, their source score sections, and the human-readable help text used by the static HTML report.",
  "modules": [
    {
      "id": "project-baseline",
      "title": "项目基线",
      "sections": ["系统规则", "开发者规则", "用户意图", "项目文件"],
      "help": "检查 README、项目状态、架构和基础运行入口，确保新成员和 AI 能先读懂项目。"
    },
    {
      "id": "agent-workbench",
      "title": "Agent 工作台",
      "sections": ["系统规则", "命名和文档治理"],
      "help": "检查 AI 工作规则、文档边界和命名规范，避免不同助手各干各的。"
    },
    {
      "id": "context-knowledge",
      "title": "上下文与知识源",
      "sections": ["项目文件"],
      "help": "检查 AI 可以依赖哪些项目文档、架构说明和真实上下文来源。"
    },
    {
      "id": "quality-gates",
      "title": "评测与质量门禁",
      "sections": ["工具反馈"],
      "help": "检查改动后怎么测试、怎么验收，以及哪些命令能阻断风险。"
    },
    {
      "id": "delivery-observability",
      "title": "交付与可观测",
      "sections": ["开发者规则", "工具反馈", "决策和运行"],
      "help": "检查运行、发布、排障、变更记录和可回溯路径是否清楚。"
    },
    {
      "id": "governance-handoff",
      "title": "治理与交接",
      "sections": ["交接摘要", "决策和运行", "命名和文档治理"],
      "help": "检查谁来接手、当前风险、关键决策和下一步是否可追溯。"
    }
  ]
}
